{
  "state": "incident",
  "since": "2026-10-24T10:15:00Z",
  "reasonCode": "drift_detected",
  "releaseSeq": 101,
  "proof": {
    "alg": "EdDSA",
    "kid": "edge-2026-10",
    "jws": "eyJhbGciOiJFZERTQSIsImtpZCI6ImVkZ2UtMjAyNi0xMCJ9..EhvcdWZAHSThlN3dv4O1hzLVF6SmFak960--VhKQlM7ghDGfhqvT7aYaW-_McbLu6noGsRodqqcX6I0oG7IpDQ"
  }
}
